id,speaker,intent,slots.keys,slots.values,utterance1,utterance2
s00001488,system,情報を教える,観光地の名称 観光地におすすめな人 観光地が雨天でも楽しめるか,富岡市立妙義 ふるさと美術館 恋人 可能,富岡市立妙義 ふるさと美術館は雨天でも問題ありませんので恋人との旅行にも良いと思います。,恋人と雨天でも楽しめる富岡市立妙義 ふるさと美術館がお勧めです。
s00001627,system,情報を教える,観光地の名称 観光地の飲食物持ち込みの可否 観光地の設備,Billboard Live TOKYO 不可能 ペットへの対応あり,Billboard Live TOKYOでは飲食の持ち込みは不可ですがペットへの対応はございます。,Billboard Live TOKYOではペットの対応があります。ただ飲食の持ち込みは不可になっております。
s00002170,system,観光地の情報を使って客におすすめする,客の名前（※） 観光地の名称 観光地の料金,小島 江戸川松戸フラワーライン 巡拝700円,小島様にお勧めなのが江戸川松戸フラワーラインです。巡拝は700円でございます。,巡拝が700円の江戸川松戸フラワーラインを小島様にお勧めいたします。
s00001252,system,情報を教える,観光地の名称 観光地におすすめな人 観光地の料金,高瀬湖 子供 2時間食べ放題デラウェア大人1000円、3歳～小学生500円。,高瀬湖では2時間食べ放題デラウェア大人1000円、3歳～小学生500円がございます。子供にもお勧めです。,子供と行ける高瀬湖では2時間食べ放題デラウェア大人1000円、3歳～小学生500円で楽しめます。
s00001889,system,情報を教える,観光地の名称 観光地の飲食物持ち込みの可否 観光地の撮影可否,雲仙ビードロ美術館 可能 不明,雲仙ビードロ美術館では飲食の持ち込みは可能になっております。ただ撮影ができるかはは不明です。,雲仙ビードロ美術館は撮影ができるのかは不明ですが飲食の持ち込みは可能になっております。
s00002046,system,情報を教える,観光地の名称 観光地の新型コロナウイルス感染対策 観光地の喫煙可否,夢のつり橋 入場時のアルコール消毒とマスクの着用 可能,夢のつり橋では入場時のアルコール消毒とマスクの着用をお願いしておりますが喫煙は可能になっております。,夢のつり橋は喫煙可能ですが入場時のアルコール消毒とマスクの着用はお願いしております。
s00001813,system,情報を教える,観光地の名称 観光地がインドアかアウトドアか 観光地のWi-Fiの有無,びわ湖観光船オーミマリン 不明 なし,びわ湖観光船オーミマリンはWi-Fiがございません。また室内なのか外の施設なのかは不明です。,びわ湖観光船オーミマリンは室内なのか外の施設なのかが不明です。またWi-Fiはございません。
s00001593,system,情報を教える,観光地の名称 観光地の設備 観光地のWi-Fiの有無,道の駅 たいじ ペットへの対応なし あり,道の駅 たいじはペットへの対応はありませんがWi-Fiはございます。,道の駅 たいじにはWi-Fiがございます。ただペットへの対応はございません。
s00000134,system,好意的に承知する,客の観光の同行者 客が希望する交通手段,乳幼児 未定,乳幼児がいらっしゃても問題ございませんし交通手段も指定はございませんのでご安心ください。,交通手段に指定はございません。また乳幼児がいても全く問題はございません。
s00001849,system,情報を教える,観光地の名称 観光地の手荷物預かりの有無 観光地の喫煙可否,尼崎市記念公園 不明 不可能,尼崎市記念公園では手荷物の預かりは不明です。また喫煙は不可になっております。,尼崎市記念公園では喫煙が不可になっております。手荷物の預かりは不明でございます。
s00001673,system,情報を教える,観光地の名称 観光地の設備 観光地の喫煙可否,東山動植物園 ペットへの対応あり 不明,東山動植物園ではペットへの対応はございますが喫煙は不可になっております。,東山動植物園では喫煙は不可になっておりますがペットへの対応はございます。
s00002083,system,情報を教える,観光地の名称 観光地の利用可能なキャッシュレス決済 観光地がインドアかアウトドアか,大垣市スイトピアセンター・こどもサイエンスプラザ・水のパビリオン・コスモドーム 不明 アウトドア,大垣市スイトピアセンター・こどもサイエンスプラザ・水のパビリオン・コスモドームは野外施設です。キャッシュレス決済については不明です。,大垣市スイトピアセンター・こどもサイエンスプラザ・水のパビリオン・コスモドームでのキャッシュレス決済は不明です。またこちらは野外施設になっております。
s00001391,system,情報を教える,観光地の名称 観光地におすすめな人 観光地の電話番号,東郷公園の紅葉 女性 098-850-1139,女性にお勧めな場所は東郷公園の紅葉です。電話番号は098-850-1139になります。,東郷公園の紅葉は女性にお勧めでございます。電話番号は098-850-1139になります。
s00001699,system,情報を教える,観光地の名称 観光地の利用可能なキャッシュレス決済 観光地の設備,白浜海水浴場 クレジットカード ペットへの対応あり,白浜海水浴場ではクレジットカードが利用でき、ペットへの対応もございます。,白浜海水浴場ではペットへの対応がございます。またクレジットカードの対応もございます。
s00000549,system,好意的に承知する,客の希望の観光時間帯 客が希望する交通手段,朝 未定,時間帯は朝でも問題ございませんし、交通手段も問いません。,どのような交通手段でも問題ございません。また時間帯は朝でも問題ございません。
s00001255,system,情報を教える,観光地の名称 観光地におすすめな人 観光地の料金,カップヌードルミュージアム 横浜 恋人 入館料200、子供100円,カップヌードルミュージアム 横浜は恋人と行くのにお勧めです。料金は入館料200、子供100円になります,恋人と行くのにお勧めなカップヌードルミュージアム 横浜の料金は入館料200、子供100円になっております。
s00000942,system,情報を教える,観光地の名称 観光地のジャンル,史跡 亀ケ岡石器時代遺跡 紅葉スポット,お勧めの紅葉スポットは史跡 亀ケ岡石器時代遺跡がございます。,史跡 亀ケ岡石器時代遺跡は紅葉スポットとしてお勧めです。
s00001636,system,情報を教える,観光地の名称 観光地の設備 観光地の撮影可否,二荒山神社 化燈籠 障害者への対応あり 不可能,二荒山神社 化燈籠では障害者への対応がございますが撮影が可能かは不明になっております。,二荒山神社 化燈籠での撮影が可能かは不明でございます。障害者への対応はございます。
s00000556,system,好意的に承知する,客の希望の観光時間帯 客が希望する交通手段,日中 未定,日中どの時間帯でもお待ちしております。また交通手段も問いません。,交通手段の指定もございませんし、お時間も日中どの時間でも大丈夫です。
s00001900,system,情報を教える,観光地の名称 観光地の飲食物持ち込みの可否 観光地の予約要否,槇果樹園 可能 不可能,槇果樹園では飲食の持ち込みは可能ですが予約は不可になっております。,槇果樹園では予約は不可です。また飲食の持ち込みは可能になっております。
